{
  "schemaVersion": 1,
  "lessonId": "l-capstone-freeze",
  "version": 1,
  "locale": "de",
  "title": "Capstone-Pipeline: Freeze und Abhängigkeitsordnung",
  "objectives": [
    "Golden Set, Angriffs-Fixtures, Experimentkonfiguration, Testdateien und den gepinnten Kern in einem sha256-Manifest einfrieren und mit assert_frozen() gegen stille Anpassungen absichern",
    "versionierte Seeds und Konfiguration als Experimentwechsel behandeln, der eine neue Version verlangt statt einer stillschweigenden Korrektur",
    "die Abhängigkeitsordnung der Pipeline-Stages aus IO-Verträgen topologisch sortieren und Zyklen als Designfehler erkennen"
  ],
  "competencyIds": [
    "c-capstone-pipeline"
  ],
  "requires": [
    "c-research-capstone",
    "c-ml-repro"
  ],
  "estimatedMinutes": 15,
  "blocks": [
    {
      "blockId": "capstone-freeze-core",
      "type": "worked-example",
      "contentRef": "lessons/research/capstone-freeze.md"
    },
    {
      "blockId": "freeze-s7-handoffs",
      "type": "worked-example",
      "contentRef": "lessons/research/capstone-freeze-s7-handoffs.md"
    },
    {
      "blockId": "s8b-freeze-order",
      "type": "figure",
      "contentRef": "lessons/research/freeze-order.fig.json"
    },
    {
      "blockId": "s8b-glossary-l-capstone-freeze",
      "type": "worked-example",
      "contentRef": "lessons/research/capstone-freeze-glossary.md"
    },
    {
      "blockId": "capstone-freeze-check",
      "type": "checkpoint",
      "contentRef": "lessons/research/capstone-freeze-checkpoint.md"
    }
  ],
  "sourceRefs": [
    {
      "sourceId": "wilson-good-enough",
      "role": "primary",
      "locator": "Good Enough Practices for Scientific Computing — Setup, Software, Tests und Fehlerbehandlung als Mindestgerüst der Pipeline"
    },
    {
      "sourceId": "turing-way",
      "role": "primary",
      "locator": "The Turing Way, Guide for Reproducible Research — Versionierung, Umgebungen und Dokumentation als Reproduktionsvertrag"
    },
    {
      "sourceId": "cookiecutter-data-science",
      "role": "practice",
      "locator": "Cookiecutter Data Science — Projektlayout für Daten, Quellen und Berichte als Ordnervertrag"
    },
    {
      "sourceId": "sandve-repro-rules",
      "role": "reference",
      "locator": "Sandve et al., Ten Simple Rules for Reproducible Computational Research — jede Zahl aus Code und Daten ableitbar halten"
    }
  ],
  "rightsId": "ki-lernplattform-original",
  "releaseStatus": "draft"
}
