{
  "schemaVersion": 1,
  "lessonId": "l-linalg-independence",
  "version": 2,
  "locale": "de",
  "title": "Lineare Unabhängigkeit und Rang verstehen",
  "objectives": [
    "Abhängigkeit über eine konkrete Linearkombination erkennen",
    "Rang als Zahl der Pivotpositionen bestimmen",
    "Determinante und Gauß-Elimination passend als Prüfwerkzeug auswählen"
  ],
  "competencyIds": [
    "c-linalg-independence"
  ],
  "requires": [
    "c-linalg-matrices"
  ],
  "estimatedMinutes": 80,
  "blocks": [
    {
      "blockId": "linalg-independence-core",
      "type": "worked-example",
      "contentRef": "lessons/linear-algebra/independence.md"
    },
    {
      "blockId": "independence-viz",
      "type": "figure",
      "contentRef": "lessons/linear-algebra/span-carpet.fig.json"
    },
    { "blockId": "independence-details", "type": "worked-example", "contentRef": "lessons/linear-algebra/independence-details.md" },
    { "blockId": "independence-cases-figure", "type": "figure", "contentRef": "lessons/linear-algebra/solution-cases-3d.fig.json" }
  ],
  "sourceRefs": [
    {
      "sourceId": "mit-ocw-18-06sc",
      "role": "reference",
      "locator": "Lectures zu Unabhängigkeit, Basis und Rang"
    },
    {
      "sourceId": "serlo-mathe",
      "role": "practice",
      "locator": "Lineare Unabhängigkeit und Rang"
    }
  ],
  "rightsId": "ki-lernplattform-original",
  "releaseStatus": "draft"
}
