{
  "schemaVersion": 1,
  "lessonId": "l-figuren-s5-archive",
  "version": 1,
  "locale": "de",
  "title": "Archiv der ersetzten Figuren S5",
  "objectives": ["Ersetzte Visualisierungen bis zur ausdrücklichen Freigabe aufbewahren"],
  "competencyIds": ["c-grad-regression", "c-ml-linear", "c-ml-regularization"],
  "requires": [],
  "estimatedMinutes": 1,
  "blocks": [
    { "blockId": "archive-mse", "type": "visualization", "contentRef": "lessons/data-ml/mse-bowl.viz.json" },
    { "blockId": "archive-residuals", "type": "visualization", "contentRef": "lessons/data-ml/residuals.viz.json" },
    { "blockId": "archive-ridge", "type": "visualization", "contentRef": "lessons/data-ml/ridge-shrink.viz.json" },
    { "blockId": "archive-pca-axis", "type": "visualization", "contentRef": "lessons/data-ml/pca-axis.viz.json" },
    { "blockId": "archive-secant", "type": "visualization", "contentRef": "lessons/data-ml/secant-tangent.viz.json" },
    { "blockId": "archive-stopping", "type": "visualization", "contentRef": "lessons/deep-learning/early-stopping.viz.json" },
    { "blockId": "archive-step", "type": "visualization", "contentRef": "lessons/deep-learning/lr-step.viz.json" }
  ],
  "sourceRefs": [],
  "rightsId": "ki-lernplattform-original",
  "releaseStatus": "local-only"
}
