{
  "schemaVersion": 1,
  "lessonId": "l-linalg-gauss",
  "version": 2,
  "locale": "de",
  "title": "Gauß-Elimination als erlaubte Umformung",
  "objectives": [
    "erlaubte Zeilenoperationen begründen",
    "eine 2×2-erweiterte Matrix in Zeilenstufenform bringen",
    "eindeutige, freie und widersprüchliche Systeme unterscheiden"
  ],
  "competencyIds": [
    "c-linalg-gauss"
  ],
  "requires": [
    "c-algebra",
    "c-linalg-systems"
  ],
  "estimatedMinutes": 55,
  "blocks": [
    {
      "blockId": "linalg-gauss-core",
      "type": "worked-example",
      "contentRef": "lessons/linear-algebra/gauss.md"
    },
    {
      "blockId": "gauss-viz",
      "type": "figure",
      "contentRef": "lessons/linear-algebra/receipt-elimination.fig.json"
    },
    { "blockId": "gauss-details", "type": "worked-example", "contentRef": "lessons/linear-algebra/gauss-details.md" },
    { "blockId": "gauss-echelon-figure", "type": "figure", "contentRef": "lessons/linear-algebra/receipt-echelon-3x3.fig.json" }
  ],
  "sourceRefs": [
    {
      "sourceId": "mit-ocw-18-06sc",
      "role": "practice",
      "locator": "Lecture 2: Elimination with Matrices"
    },
    {
      "sourceId": "wikibooks-mfnf",
      "role": "remedial",
      "locator": "Gaußverfahren und Lösungsfälle"
    }
  ],
  "rightsId": "ki-lernplattform-original",
  "releaseStatus": "draft"
}
