{
  "schemaVersion": 1,
  "lessonId": "l-eda-distributions",
  "version": 2,
  "locale": "de",
  "title": "Verteilungen zusammenfassen und vergleichen",
  "objectives": [
    "Verteilungen durch Histogramm-Bins, Median, Quartile und Schiefe zusammenfassen",
    "die Diagrammart aus der Fragestellung ableiten und Korrelation mit np.corrcoef berechnen",
    "Korrelation von Kausalität trennen und bedingte Wahrscheinlichkeit als Spaltenanteil lesen"
  ],
  "competencyIds": ["c-eda-viz"],
  "requires": ["c-pandas-cleaning"],
  "estimatedMinutes": 60,
  "blocks": [
    {
      "blockId": "eda-distributions-core",
      "type": "worked-example",
      "contentRef": "lessons/data-ml/eda-distributions.md"
    },
    {
      "blockId": "eda-distributions-s8a-figure",
      "type": "figure",
      "contentRef": "lessons/data-ml/distribution-points.fig.json"
    },
    {
      "blockId": "eda-distributions-s8a-after",
      "type": "worked-example",
      "contentRef": "lessons/data-ml/eda-distributions-s8a-after.md"
    },
    {
      "blockId": "eda-distributions-viz",
      "type": "visualization",
      "contentRef": "lessons/data-ml/normal-density.viz.json"
    }
  ],
  "sourceRefs": [
    { "sourceId": "openintro-statistics", "role": "primary", "locator": "Ch 2 Summarizing Data; Ch 3 Probability (bedingte Wahrscheinlichkeit); Ch 4 Distributions" },
    { "sourceId": "wilke-dataviz", "role": "practice", "locator": "Kapitel zu Histogrammen und Verteilungsformen — nur Verweis, CC BY-NC-ND" },
    { "sourceId": "numpy-docs", "role": "practice", "locator": "np.corrcoef Dokumentation" }
  ],
  "rightsId": "ki-lernplattform-original",
  "releaseStatus": "draft"
}
