{
  "schemaVersion": 1,
  "lessonId": "l-foundations-python-state",
  "version": 3,
  "locale": "de",
  "title": "Python-Zustand statt Code-Raten",
  "objectives": ["Zuweisungen als Zustandsänderung lesen", "Werte und Typen von Variablennamen unterscheiden", "kurze Programme mit einer Tracetabelle prüfen"],
  "competencyIds": ["c-python-basics"],
  "requires": [],
  "estimatedMinutes": 55,
  "blocks": [
    {"blockId":"python-state-core","type":"worked-example","contentRef":"lessons/foundations/python-state.md"},
    {"blockId":"name-tags","type":"figure","contentRef":"lessons/foundations/name-tags.fig.json"},
    {"blockId":"python-state-core-after-trace","type":"worked-example","contentRef":"lessons/foundations/python-state-trace-after.md"}
  ],
  "sourceRefs": [
    { "sourceId": "py-tutorial-official-3.14", "role": "reference", "locator": "Kapitel 3: An Informal Introduction to Python" }
  ],
  "rightsId": "ki-lernplattform-original",
  "releaseStatus": "draft"
}
