{
  "schemaVersion": 1,
  "lessonId": "l-capstone-pipeline",
  "version": 1,
  "locale": "de",
  "title": "Reproduzierbare Capstone-Pipeline: Manifest, Stages, feste Evaluation, Red-Team, Demo",
  "objectives": [
    "Datenfluss, GenAI-Komponenten, Tests und Evaluation zu einer reproduzierbaren Pipeline mit Manifest, Freeze und IO-Verträgen zusammensetzen",
    "Retrieval-, Subgruppen- und Sicherheitsmetriken gegen eingefrorene Erwartungen prüfen und ein Regelwerk-Verdict daraus ableiten",
    "Doppellauf-Reproduktion, gepinnte Versionen, Overclaim-freie Dokumentation und eine Demo aus festen Messwerten vornehmen — mit Work Evidence statt Mastery-Behauptung"
  ],
  "competencyIds": [
    "c-capstone-pipeline"
  ],
  "requires": [
    "c-research-capstone",
    "c-ml-repro"
  ],
  "estimatedMinutes": 60,
  "blocks": [
    {
      "blockId": "capstone-pipeline-core",
      "type": "worked-example",
      "contentRef": "lessons/research/capstone-pipeline.md"
    },
    {
      "blockId": "capstone-pipeline-check",
      "type": "checkpoint",
      "contentRef": "lessons/research/capstone-pipeline-checkpoint.md"
    }
  ],
  "sourceRefs": [
    {
      "sourceId": "wilson-good-enough",
      "role": "primary",
      "locator": "Good Enough Practices for Scientific Computing — Setup, Software, Tests und Fehlerbehandlung als Mindestgerüst der Pipeline"
    },
    {
      "sourceId": "turing-way",
      "role": "primary",
      "locator": "The Turing Way, Guide for Reproducible Research — Versionierung, Umgebungen und Dokumentation als Reproduktionsvertrag"
    },
    {
      "sourceId": "cookiecutter-data-science",
      "role": "practice",
      "locator": "Cookiecutter Data Science — Projektlayout für Daten, Quellen und Berichte als Ordnervertrag"
    },
    {
      "sourceId": "sandve-repro-rules",
      "role": "reference",
      "locator": "Sandve et al., Ten Simple Rules for Reproducible Computational Research — jede Zahl aus Code und Daten ableitbar halten"
    },
    {
      "sourceId": "acm-artifact-badging",
      "role": "reference",
      "locator": "ACM Artefact Badging — Available/Functional/Reproduced als Stufen überprüfbarer Artefakte"
    },
    {
      "sourceId": "rougier-figures",
      "role": "practice",
      "locator": "Rougier et al., Ten Simple Rules for Better Figures — Demo-Ansichten aus eingefrorenen Messwerten, nicht aus Gedächtnis"
    }
  ],
  "rightsId": "ki-lernplattform-original",
  "releaseStatus": "draft"
}
