{
  "schemaVersion": 1,
  "lessonId": "l-capstone-repro",
  "version": 1,
  "locale": "de",
  "title": "Capstone-Pipeline: Evidenz und Reproduzierbarkeit",
  "objectives": [
    "Reproduktion als Doppellauf mit Digest-Vergleich über der kanonischen Serialisierung prüfen und Versionen exakt statt als Bereichs-Spec pinnen",
    "Dokumentation mit Pflichtüberschriften, ohne Overclaims und ohne absolute Pfade des eigenen Rechners verlangen",
    "Demo und Berichte als Arbeitsnachweise von Mastery unterscheiden und die Grenze des selbstberichteten Nachweises offenlegen"
  ],
  "competencyIds": [
    "c-capstone-pipeline"
  ],
  "requires": [
    "c-research-capstone",
    "c-ml-repro"
  ],
  "estimatedMinutes": 15,
  "blocks": [
    {
      "blockId": "capstone-repro-core",
      "type": "worked-example",
      "contentRef": "lessons/research/capstone-repro.md"
    },
    {
      "blockId": "s8b-reproduction-record",
      "type": "figure",
      "contentRef": "lessons/research/reproduction-record.fig.json"
    },
    {
      "blockId": "capstone-repro-check",
      "type": "checkpoint",
      "contentRef": "lessons/research/capstone-repro-checkpoint.md"
    }
  ],
  "sourceRefs": [
    {
      "sourceId": "wilson-good-enough",
      "role": "primary",
      "locator": "Good Enough Practices for Scientific Computing — Setup, Software, Tests und Fehlerbehandlung als Mindestgerüst der Pipeline"
    },
    {
      "sourceId": "turing-way",
      "role": "primary",
      "locator": "The Turing Way, Guide for Reproducible Research — Versionierung, Umgebungen und Dokumentation als Reproduktionsvertrag"
    },
    {
      "sourceId": "sandve-repro-rules",
      "role": "reference",
      "locator": "Sandve et al., Ten Simple Rules for Reproducible Computational Research — jede Zahl aus Code und Daten ableitbar halten"
    },
    {
      "sourceId": "acm-artifact-badging",
      "role": "reference",
      "locator": "ACM Artefact Badging — Available/Functional/Reproduced als Stufen überprüfbarer Artefakte"
    },
    {
      "sourceId": "rougier-figures",
      "role": "practice",
      "locator": "Rougier et al., Ten Simple Rules for Better Figures — Demo-Ansichten aus eingefrorenen Messwerten, nicht aus Gedächtnis"
    }
  ],
  "rightsId": "ki-lernplattform-original",
  "releaseStatus": "draft"
}
