{
  "schemaVersion": 1,
  "lessonId": "l-ml-logistic",
  "version": 2,
  "locale": "de",
  "title": "Sigmoid auswerten und Labels setzen",
  "objectives": [
    "die Sigmoid-Funktion auswerten und Wahrscheinlichkeiten mit einem Schwellenwert in Labels überführen",
    "Präzision, Recall und F1 aus einer Konfusionsmatrix berechnen",
    "den Schwellenwert an den Fehlerkosten von falsch positiv und falsch negativ ausrichten"
  ],
  "competencyIds": [
    "c-ml-logistic"
  ],
  "requires": [
    "c-ml-linear"
  ],
  "estimatedMinutes": 65,
  "blocks": [
    {
      "blockId": "ml-logistic-core",
      "type": "worked-example",
      "contentRef": "lessons/data-ml/ml-logistic.md"
    },
    { "blockId": "logistic-sorter-figure", "type": "figure", "contentRef": "lessons/data-ml/logistic-sorter.fig.json" },
    { "blockId": "ml-logistic-s7-after", "type": "worked-example", "contentRef": "lessons/data-ml/ml-logistic-s7-after.md" }
  ],
  "sourceRefs": [
    {
      "sourceId": "openintro-statistics",
      "role": "primary",
      "locator": "Ch 9 Multiple and Logistic Regression"
    },
    {
      "sourceId": "sklearn-user-guide",
      "role": "practice",
      "locator": "Logistic Regression + Classification metrics — nur Lektüre"
    }
  ],
  "rightsId": "ki-lernplattform-original",
  "releaseStatus": "draft"
}
